09:25:12.254580 IP 172.19.0.3.56002 > 172.19.0.2.http: Flags [S], seq 499479553, win 64240, options [mss 1460,sackOK,TS val 4033624255 ecr 0,nop,wscale 7], length 0
09:25:12.254662 IP 172.19.0.2.http > 172.19.0.3.56002: Flags [S.], seq 3646268676, ack 499479554, win 65160, options [mss 1460,sackOK,TS val 1503336374 ecr 4033624255,nop,wscale 7], length 0
09:25:12.254694 IP 172.19.0.3.56002 > 172.19.0.2.http: Flags [.], ack 1, win 502, options [nop,nop,TS val 4033624255 ecr 1503336374], length 0
09:25:12.254823 IP 172.19.0.3.56002 > 172.19.0.2.http: Flags [P.], seq 1:86, ack 1, win 502, options [nop,nop,TS val 4033624255 ecr 1503336374], length 85: HTTP: GET /video.mp4 HTTP/1.1
09:25:12.254862 IP 172.19.0.2.http > 172.19.0.3.56002: Flags [.], ack 86, win 509, options [nop,nop,TS val 1503336374 ecr 4033624255], length 0
09:25:12.255093 IP 172.19.0.2.http > 172.19.0.3.56002: Flags [P.], seq 1:7241, ack 86, win 509, options [nop,nop,TS val 1503336374 ecr 4033624255], length 7240: HTTP: HTTP/1.1 200 OK
09:25:12.255128 IP 172.19.0.3.56002 > 172.19.0.2.http: Flags [.], ack 7241, win 614, options [nop,nop,TS val 4033624255 ecr 1503336374], length 0
09:25:12.255175 IP 172.19.0.2.http > 172.19.0.3.56002: Flags [P.], seq 7241:14481, ack 86, win 509, options [nop,nop,TS val 1503336374 ecr 4033624255], length 7240: HTTP
09:25:12.255191 IP 172.19.0.3.56002 > 172.19.0.2.http: Flags [.], ack 14481, win 727, options [nop,nop,TS val 4033624255 ecr 1503336374], length 0
09:25:12.255237 IP 172.19.0.2.http > 172.19.0.3.56002: Flags [P.], seq 14481:28961, ack 86, win 509, options [nop,nop,TS val 1503336374 ecr 4033624255], length 14480: HTTP
09:25:12.255255 IP 172.19.0.3.56002 > 172.19.0.2.http: Flags [.], ack 28961, win 802, options [nop,nop,TS val 4033624255 ecr 1503336374], length 0
09:25:12.255286 IP 172.19.0.2.http > 172.19.0.3.56002: Flags [P.], seq 28961:33039, ack 86, win 509, options [nop,nop,TS val 1503336374 ecr 4033624255], length 4078: HTTP
09:25:12.255302 IP 172.19.0.3.56002 > 172.19.0.2.http: Flags [.], ack 33039, win 866, options [nop,nop,TS val 4033624255 ecr 1503336374], length 0
09:25:12.255400 IP 172.19.0.2.http > 172.19.0.3.56002: Flags [P.], seq 33039:56207, ack 86, win 509, options [nop,nop,TS val 1503336375 ecr 4033624255], length 23168: HTTP
09:25:12.255421 IP 172.19.0.3.56002 > 172.19.0.2.http: Flags [.], ack 56207, win 742, options [nop,nop,TS val 4033624256 ecr 1503336375], length 0
09:25:12.255460 IP 172.19.0.2.http > 172.19.0.3.56002: Flags [P.], seq 56207:65807, ack 86, win 509, options [nop,nop,TS val 1503336375 ecr 4033624255], length 9600: HTTP
09:25:12.255477 IP 172.19.0.3.56002 > 172.19.0.2.http: Flags [.], ack 65807, win 836, options [nop,nop,TS val 4033624256 ecr 1503336375], length 0
09:25:12.255547 IP 172.19.0.2.http > 172.19.0.3.56002: Flags [P.], seq 65807:98575, ack 86, win 509, options [nop,nop,TS val 1503336375 ecr 4033624256], length 32768: HTTP
09:25:12.255565 IP 172.19.0.3.56002 > 172.19.0.2.http: Flags [.], ack 98575, win 675, options [nop,nop,TS val 4033624256 ecr 1503336375], length 0
09:25:12.255625 IP 172.19.0.2.http > 172.19.0.3.56002: Flags [P.], seq 98575:131343, ack 86, win 509, options [nop,nop,TS val 1503336375 ecr 4033624256], length 32768: HTTP
09:25:12.255642 IP 172.19.0.3.56002 > 172.19.0.2.http: Flags [.], ack 131343, win 1378, options [nop,nop,TS val 4033624256 ecr 1503336375], length 0
09:25:12.255701 IP 172.19.0.2.http > 172.19.0.3.56002: Flags [P.], seq 131343:164111, ack 86, win 509, options [nop,nop,TS val 1503336375 ecr 4033624256], length 32768: HTTP
09:25:12.255718 IP 172.19.0.3.56002 > 172.19.0.2.http: Flags [.], ack 164111, win 1890, options [nop,nop,TS val 4033624256 ecr 1503336375], length 0
09:25:12.255776 IP 172.19.0.2.http > 172.19.0.3.56002: Flags [P.], seq 164111:196879, ack 86, win 509, options [nop,nop,TS val 1503336375 ecr 4033624256], length 32768: HTTP
09:25:12.255794 IP 172.19.0.3.56002 > 172.19.0.2.http: Flags [.], ack 196879, win 2402, options [nop,nop,TS val 4033624256 ecr 1503336375], length 0
09:25:12.255852 IP 172.19.0.2.http > 172.19.0.3.56002: Flags [P.], seq 196879:229647, ack 86, win 509, options [nop,nop,TS val 1503336375 ecr 4033624256], length 32768: HTTP
09:25:12.255869 IP 172.19.0.3.56002 > 172.19.0.2.http: Flags [.], ack 229647, win 2914, options [nop,nop,TS val 4033624256 ecr 1503336375], length 0
09:25:12.255933 IP 172.19.0.2.http > 172.19.0.3.56002: Flags [P.], seq 229647:262415, ack 86, win 509, options [nop,nop,TS val 1503336375 ecr 4033624256], length 32768: HTTP
09:25:12.255953 IP 172.19.0.3.56002 > 172.19.0.2.http: Flags [.], ack 262415, win 3426, options [nop,nop,TS val 4033624256 ecr 1503336375], length 0
09:25:12.256016 IP 172.19.0.2.http > 172.19.0.3.56002: Flags [P.], seq 262415:295183, ack 86, win 509, options [nop,nop,TS val 1503336375 ecr 4033624256], length 32768: HTTP
09:25:12.256032 IP 172.19.0.3.56002 > 172.19.0.2.http: Flags [.], ack 295183, win 3938, options [nop,nop,TS val 4033624256 ecr 1503336375], length 0
09:25:12.256072 IP 172.19.0.2.http > 172.19.0.3.56002: Flags [P.], seq 295183:327951, ack 86, win 509, options [nop,nop,TS val 1503336375 ecr 4033624256], length 32768: HTTP
09:25:12.256084 IP 172.19.0.3.56002 > 172.19.0.2.http: Flags [.], ack 327951, win 4450, options [nop,nop,TS val 4033624256 ecr 1503336375], length 0
09:25:12.256119 IP 172.19.0.2.http > 172.19.0.3.56002: Flags [P.], seq 327951:360719, ack 86, win 509, options [nop,nop,TS val 1503336375 ecr 4033624256], length 32768: HTTP
09:25:12.256126 IP 172.19.0.3.56002 > 172.19.0.2.http: Flags [.], ack 360719, win 4962, options [nop,nop,TS val 4033624256 ecr 1503336375], length 0
09:25:12.256161 IP 172.19.0.2.http > 172.19.0.3.56002: Flags [P.], seq 360719:393487, ack 86, win 509, options [nop,nop,TS val 1503336375 ecr 4033624256], length 32768: HTTP
09:25:12.256170 IP 172.19.0.3.56002 > 172.19.0.2.http: Flags [.], ack 393487, win 5474, options [nop,nop,TS val 4033624256 ecr 1503336375], length 0
09:25:12.256205 IP 172.19.0.2.http > 172.19.0.3.56002: Flags [P.], seq 393487:426255, ack 86, win 509, options [nop,nop,TS val 1503336375 ecr 4033624256], length 32768: HTTP
09:25:12.256214 IP 172.19.0.3.56002 > 172.19.0.2.http: Flags [.], ack 426255, win 5986, options [nop,nop,TS val 4033624256 ecr 1503336375], length 0
09:25:12.256248 IP 172.19.0.2.http > 172.19.0.3.56002: Flags [P.], seq 426255:459023, ack 86, win 509, options [nop,nop,TS val 1503336375 ecr 4033624256], length 32768: HTTP
09:25:12.256258 IP 172.19.0.3.56002 > 172.19.0.2.http: Flags [.], ack 459023, win 6498, options [nop,nop,TS val 4033624256 ecr 1503336375], length 0
09:25:12.256290 IP 172.19.0.2.http > 172.19.0.3.56002: Flags [P.], seq 459023:491791, ack 86, win 509, options [nop,nop,TS val 1503336375 ecr 4033624256], length 32768: HTTP
09:25:12.256301 IP 172.19.0.3.56002 > 172.19.0.2.http: Flags [.], ack 491791, win 7010, options [nop,nop,TS val 4033624256 ecr 1503336375], length 0
09:25:12.256336 IP 172.19.0.2.http > 172.19.0.3.56002: Flags [P.], seq 491791:524559, ack 86, win 509, options [nop,nop,TS val 1503336375 ecr 4033624256], length 32768: HTTP
09:25:12.256347 IP 172.19.0.3.56002 > 172.19.0.2.http: Flags [.], ack 524559, win 7522, options [nop,nop,TS val 4033624256 ecr 1503336375], length 0
09:25:12.256400 IP 172.19.0.2.http > 172.19.0.3.56002: Flags [P.], seq 524559:557327, ack 86, win 509, options [nop,nop,TS val 1503336376 ecr 4033624256], length 32768: HTTP
09:25:12.256409 IP 172.19.0.3.56002 > 172.19.0.2.http: Flags [.], ack 557327, win 8034, options [nop,nop,TS val 4033624257 ecr 1503336376], length 0
09:25:12.256444 IP 172.19.0.2.http > 172.19.0.3.56002: Flags [P.], seq 557327:590095, ack 86, win 509, options [nop,nop,TS val 1503336376 ecr 4033624257], length 32768: HTTP
09:25:12.256455 IP 172.19.0.3.56002 > 172.19.0.2.http: Flags [.], ack 590095, win 8546, options [nop,nop,TS val 4033624257 ecr 1503336376], length 0
09:25:12.256489 IP 172.19.0.2.http > 172.19.0.3.56002: Flags [P.], seq 590095:622863, ack 86, win 509, options [nop,nop,TS val 1503336376 ecr 4033624257], length 32768: HTTP
09:25:12.256500 IP 172.19.0.3.56002 > 172.19.0.2.http: Flags [.], ack 622863, win 9058, options [nop,nop,TS val 4033624257 ecr 1503336376], length 0
09:25:12.256535 IP 172.19.0.2.http > 172.19.0.3.56002: Flags [P.], seq 622863:655631, ack 86, win 509, options [nop,nop,TS val 1503336376 ecr 4033624257], length 32768: HTTP
09:25:12.256546 IP 172.19.0.3.56002 > 172.19.0.2.http: Flags [.], ack 655631, win 9570, options [nop,nop,TS val 4033624257 ecr 1503336376], length 0
09:25:12.256581 IP 172.19.0.2.http > 172.19.0.3.56002: Flags [P.], seq 655631:688399, ack 86, win 509, options [nop,nop,TS val 1503336376 ecr 4033624257], length 32768: HTTP
09:25:12.256592 IP 172.19.0.3.56002 > 172.19.0.2.http: Flags [.], ack 688399, win 10082, options [nop,nop,TS val 4033624257 ecr 1503336376], length 0
09:25:12.256627 IP 172.19.0.2.http > 172.19.0.3.56002: Flags [P.], seq 688399:721167, ack 86, win 509, options [nop,nop,TS val 1503336376 ecr 4033624257], length 32768: HTTP
09:25:12.256636 IP 172.19.0.3.56002 > 172.19.0.2.http: Flags [.], ack 721167, win 10594, options [nop,nop,TS val 4033624257 ecr 1503336376], length 0
09:25:12.256669 IP 172.19.0.2.http > 172.19.0.3.56002: Flags [P.], seq 721167:753935, ack 86, win 509, options [nop,nop,TS val 1503336376 ecr 4033624257], length 32768: HTTP
09:25:12.256680 IP 172.19.0.3.56002 > 172.19.0.2.http: Flags [.], ack 753935, win 11106, options [nop,nop,TS val 4033624257 ecr 1503336376], length 0
09:25:12.256713 IP 172.19.0.2.http > 172.19.0.3.56002: Flags [P.], seq 753935:786703, ack 86, win 509, options [nop,nop,TS val 1503336376 ecr 4033624257], length 32768: HTTP
09:25:12.256722 IP 172.19.0.3.56002 > 172.19.0.2.http: Flags [.], ack 786703, win 11618, options [nop,nop,TS val 4033624257 ecr 1503336376], length 0
09:25:12.256757 IP 172.19.0.2.http > 172.19.0.3.56002: Flags [P.], seq 786703:819471, ack 86, win 509, options [nop,nop,TS val 1503336376 ecr 4033624257], length 32768: HTTP
09:25:12.256765 IP 172.19.0.3.56002 > 172.19.0.2.http: Flags [.], ack 819471, win 12130, options [nop,nop,TS val 4033624257 ecr 1503336376], length 0
09:25:12.256799 IP 172.19.0.2.http > 172.19.0.3.56002: Flags [P.], seq 819471:852239, ack 86, win 509, options [nop,nop,TS val 1503336376 ecr 4033624257], length 32768: HTTP
09:25:12.256806 IP 172.19.0.3.56002 > 172.19.0.2.http: Flags [.], ack 852239, win 12642, options [nop,nop,TS val 4033624257 ecr 1503336376], length 0
09:25:12.256838 IP 172.19.0.2.http > 172.19.0.3.56002: Flags [P.], seq 852239:885007, ack 86, win 509, options [nop,nop,TS val 1503336376 ecr 4033624257], length 32768: HTTP
09:25:12.256847 IP 172.19.0.3.56002 > 172.19.0.2.http: Flags [.], ack 885007, win 13154, options [nop,nop,TS val 4033624257 ecr 1503336376], length 0
09:25:12.256881 IP 172.19.0.2.http > 172.19.0.3.56002: Flags [P.], seq 885007:917775, ack 86, win 509, options [nop,nop,TS val 1503336376 ecr 4033624257], length 32768: HTTP
09:25:12.256889 IP 172.19.0.3.56002 > 172.19.0.2.http: Flags [.], ack 917775, win 13666, options [nop,nop,TS val 4033624257 ecr 1503336376], length 0
09:25:12.256923 IP 172.19.0.2.http > 172.19.0.3.56002: Flags [P.], seq 917775:950543, ack 86, win 509, options [nop,nop,TS val 1503336376 ecr 4033624257], length 32768: HTTP
09:25:12.256931 IP 172.19.0.3.56002 > 172.19.0.2.http: Flags [.], ack 950543, win 14178, options [nop,nop,TS val 4033624257 ecr 1503336376], length 0
09:25:12.256965 IP 172.19.0.2.http > 172.19.0.3.56002: Flags [P.], seq 950543:983311, ack 86, win 509, options [nop,nop,TS val 1503336376 ecr 4033624257], length 32768: HTTP
09:25:12.256973 IP 172.19.0.3.56002 > 172.19.0.2.http: Flags [.], ack 983311, win 14690, options [nop,nop,TS val 4033624257 ecr 1503336376], length 0
09:25:12.257007 IP 172.19.0.2.http > 172.19.0.3.56002: Flags [P.], seq 983311:1016079, ack 86, win 509, options [nop,nop,TS val 1503336376 ecr 4033624257], length 32768: HTTP
09:25:12.257015 IP 172.19.0.3.56002 > 172.19.0.2.http: Flags [.], ack 1016079, win 15202, options [nop,nop,TS val 4033624257 ecr 1503336376], length 0
09:25:12.257050 IP 172.19.0.2.http > 172.19.0.3.56002: Flags [P.], seq 1016079:1048847, ack 86, win 509, options [nop,nop,TS val 1503336376 ecr 4033624257], length 32768: HTTP
09:25:12.257059 IP 172.19.0.3.56002 > 172.19.0.2.http: Flags [.], ack 1048847, win 15714, options [nop,nop,TS val 4033624257 ecr 1503336376], length 0
09:25:12.257094 IP 172.19.0.2.http > 172.19.0.3.56002: Flags [P.], seq 1048847:1081615, ack 86, win 509, options [nop,nop,TS val 1503336376 ecr 4033624257], length 32768: HTTP
09:25:12.257105 IP 172.19.0.3.56002 > 172.19.0.2.http: Flags [.], ack 1081615, win 16226, options [nop,nop,TS val 4033624257 ecr 1503336376], length 0
09:25:12.257137 IP 172.19.0.2.http > 172.19.0.3.56002: Flags [P.], seq 1081615:1114383, ack 86, win 509, options [nop,nop,TS val 1503336376 ecr 4033624257], length 32768: HTTP
09:25:12.257146 IP 172.19.0.3.56002 > 172.19.0.2.http: Flags [.], ack 1114383, win 16738, options [nop,nop,TS val 4033624257 ecr 1503336376], length 0
09:25:12.257180 IP 172.19.0.2.http > 172.19.0.3.56002: Flags [P.], seq 1114383:1147151, ack 86, win 509, options [nop,nop,TS val 1503336376 ecr 4033624257], length 32768: HTTP
09:25:12.257189 IP 172.19.0.3.56002 > 172.19.0.2.http: Flags [.], ack 1147151, win 17250, options [nop,nop,TS val 4033624257 ecr 1503336376], length 0
09:25:12.257222 IP 172.19.0.2.http > 172.19.0.3.56002: Flags [P.], seq 1147151:1179919, ack 86, win 509, options [nop,nop,TS val 1503336376 ecr 4033624257], length 32768: HTTP
09:25:12.257234 IP 172.19.0.3.56002 > 172.19.0.2.http: Flags [.], ack 1179919, win 17762, options [nop,nop,TS val 4033624257 ecr 1503336376], length 0
09:25:12.257267 IP 172.19.0.2.http > 172.19.0.3.56002: Flags [P.], seq 1179919:1212687, ack 86, win 509, options [nop,nop,TS val 1503336376 ecr 4033624257], length 32768: HTTP
09:25:12.257276 IP 172.19.0.3.56002 > 172.19.0.2.http: Flags [.], ack 1212687, win 18274, options [nop,nop,TS val 4033624257 ecr 1503336376], length 0
09:25:12.257308 IP 172.19.0.2.http > 172.19.0.3.56002: Flags [P.], seq 1212687:1245455, ack 86, win 509, options [nop,nop,TS val 1503336376 ecr 4033624257], length 32768: HTTP
09:25:12.257317 IP 172.19.0.3.56002 > 172.19.0.2.http: Flags [.], ack 1245455, win 18786, options [nop,nop,TS val 4033624257 ecr 1503336376], length 0
09:25:12.257361 IP 172.19.0.2.http > 172.19.0.3.56002: Flags [P.], seq 1245455:1278223, ack 86, win 509, options [nop,nop,TS val 1503336376 ecr 4033624257], length 32768: HTTP
09:25:12.257370 IP 172.19.0.3.56002 > 172.19.0.2.http: Flags [.], ack 1278223, win 19298, options [nop,nop,TS val 4033624258 ecr 1503336376], length 0
09:25:12.257405 IP 172.19.0.2.http > 172.19.0.3.56002: Flags [P.], seq 1278223:1310991, ack 86, win 509, options [nop,nop,TS val 1503336377 ecr 4033624258], length 32768: HTTP
09:25:12.257414 IP 172.19.0.3.56002 > 172.19.0.2.http: Flags [.], ack 1310991, win 19810, options [nop,nop,TS val 4033624258 ecr 1503336377], length 0
09:25:12.257445 IP 172.19.0.2.http > 172.19.0.3.56002: Flags [P.], seq 1310991:1343759, ack 86, win 509, options [nop,nop,TS val 1503336377 ecr 4033624258], length 32768: HTTP
09:25:12.257453 IP 172.19.0.3.56002 > 172.19.0.2.http: Flags [.], ack 1343759, win 20322, options [nop,nop,TS val 4033624258 ecr 1503336377], length 0
09:25:12.257484 IP 172.19.0.2.http > 172.19.0.3.56002: Flags [P.], seq 1343759:1376527, ack 86, win 509, options [nop,nop,TS val 1503336377 ecr 4033624258], length 32768: HTTP
09:25:12.257492 IP 172.19.0.3.56002 > 172.19.0.2.http: Flags [.], ack 1376527, win 20834, options [nop,nop,TS val 4033624258 ecr 1503336377], length 0
09:25:12.257525 IP 172.19.0.2.http > 172.19.0.3.56002: Flags [P.], seq 1376527:1409295, ack 86, win 509, options [nop,nop,TS val 1503336377 ecr 4033624258], length 32768: HTTP
09:25:12.257534 IP 172.19.0.3.56002 > 172.19.0.2.http: Flags [.], ack 1409295, win 21346, options [nop,nop,TS val 4033624258 ecr 1503336377], length 0
09:25:12.257562 IP 172.19.0.2.http > 172.19.0.3.56002: Flags [P.], seq 1409295:1428756, ack 86, win 509, options [nop,nop,TS val 1503336377 ecr 4033624258], length 19461: HTTP
09:25:12.257571 IP 172.19.0.3.56002 > 172.19.0.2.http: Flags [.], ack 1428756, win 21573, options [nop,nop,TS val 4033624258 ecr 1503336377], length 0
09:25:12.257722 IP 172.19.0.3.56002 > 172.19.0.2.http: Flags [F.], seq 86, ack 1428756, win 21573, options [nop,nop,TS val 4033624258 ecr 1503336377], length 0
09:25:12.257775 IP 172.19.0.2.http > 172.19.0.3.56002: Flags [F.], seq 1428756, ack 87, win 509, options [nop,nop,TS val 1503336377 ecr 4033624258], length 0
09:25:12.257791 IP 172.19.0.3.56002 > 172.19.0.2.http: Flags [.], ack 1428757, win 21573, options [nop,nop,TS val 4033624258 ecr 1503336377], length 0
09:25:17.265680 IP 172.19.0.3.40068 > 172.19.0.2.http: Flags [S], seq 2759276576, win 64240, options [mss 1460,sackOK,TS val 4033629266 ecr 0,nop,wscale 7], length 0
09:25:17.265761 IP 172.19.0.2.http > 172.19.0.3.40068: Flags [S.], seq 1418990989, ack 2759276577, win 65160, options [mss 1460,sackOK,TS val 1503341385 ecr 4033629266,nop,wscale 7], length 0
09:25:17.265793 IP 172.19.0.3.40068 > 172.19.0.2.http: Flags [.], ack 1, win 502, options [nop,nop,TS val 4033629266 ecr 1503341385], length 0
09:25:17.265918 IP 172.19.0.3.40068 > 172.19.0.2.http: Flags [P.], seq 1:86, ack 1, win 502, options [nop,nop,TS val 4033629266 ecr 1503341385], length 85: HTTP: GET /video.mp4 HTTP/1.1
09:25:17.265955 IP 172.19.0.2.http > 172.19.0.3.40068: Flags [.], ack 86, win 509, options [nop,nop,TS val 1503341385 ecr 4033629266], length 0
09:25:17.266079 IP 172.19.0.2.http > 172.19.0.3.40068: Flags [P.], seq 1:7241, ack 86, win 509, options [nop,nop,TS val 1503341385 ecr 4033629266], length 7240: HTTP: HTTP/1.1 200 OK
09:25:17.266093 IP 172.19.0.3.40068 > 172.19.0.2.http: Flags [.], ack 7241, win 614, options [nop,nop,TS val 4033629266 ecr 1503341385], length 0
09:25:17.266117 IP 172.19.0.2.http > 172.19.0.3.40068: Flags [P.], seq 7241:14481, ack 86, win 509, options [nop,nop,TS val 1503341385 ecr 4033629266], length 7240: HTTP
09:25:17.266134 IP 172.19.0.3.40068 > 172.19.0.2.http: Flags [.], ack 14481, win 727, options [nop,nop,TS val 4033629266 ecr 1503341385], length 0
09:25:17.266136 IP 172.19.0.2.http > 172.19.0.3.40068: Flags [P.], seq 14481:24617, ack 86, win 509, options [nop,nop,TS val 1503341385 ecr 4033629266], length 10136: HTTP
09:25:17.266145 IP 172.19.0.3.40068 > 172.19.0.2.http: Flags [.], ack 24617, win 776, options [nop,nop,TS val 4033629266 ecr 1503341385], length 0
09:25:17.266160 IP 172.19.0.2.http > 172.19.0.3.40068: Flags [P.], seq 24617:28961, ack 86, win 509, options [nop,nop,TS val 1503341385 ecr 4033629266], length 4344: HTTP
09:25:17.266168 IP 172.19.0.3.40068 > 172.19.0.2.http: Flags [.], ack 28961, win 743, options [nop,nop,TS val 4033629266 ecr 1503341385], length 0
09:25:17.266187 IP 172.19.0.2.http > 172.19.0.3.40068: Flags [P.], seq 28961:33039, ack 86, win 509, options [nop,nop,TS val 1503341385 ecr 4033629266], length 4078: HTTP
09:25:17.266196 IP 172.19.0.3.40068 > 172.19.0.2.http: Flags [.], ack 33039, win 712, options [nop,nop,TS val 4033629266 ecr 1503341385], length 0
09:25:17.266230 IP 172.19.0.2.http > 172.19.0.3.40068: Flags [P.], seq 33039:54759, ack 86, win 509, options [nop,nop,TS val 1503341385 ecr 4033629266], length 21720: HTTP
09:25:17.266241 IP 172.19.0.2.http > 172.19.0.3.40068: Flags [P.], seq 54759:65807, ack 86, win 509, options [nop,nop,TS val 1503341385 ecr 4033629266], length 11048: HTTP
09:25:17.266265 IP 172.19.0.3.40068 > 172.19.0.2.http: Flags [.], ack 65807, win 669, options [nop,nop,TS val 4033629266 ecr 1503341385], length 0
09:25:17.266275 IP 172.19.0.2.http > 172.19.0.3.40068: Flags [P.], seq 65807:75943, ack 86, win 509, options [nop,nop,TS val 1503341385 ecr 4033629266], length 10136: HTTP
09:25:17.266303 IP 172.19.0.2.http > 172.19.0.3.40068: Flags [P.], seq 75943:113591, ack 86, win 509, options [nop,nop,TS val 1503341385 ecr 4033629266], length 37648: HTTP
09:25:17.266315 IP 172.19.0.2.http > 172.19.0.3.40068: Flags [P.], seq 113591:122279, ack 86, win 509, options [nop,nop,TS val 1503341385 ecr 4033629266], length 8688: HTTP
09:25:17.266323 IP 172.19.0.3.40068 > 172.19.0.2.http: Flags [.], ack 75943, win 776, options [nop,nop,TS val 4033629266 ecr 1503341385], length 0
09:25:17.266349 IP 172.19.0.3.40068 > 172.19.0.2.http: Flags [.], ack 122279, win 1500, options [nop,nop,TS val 4033629266 ecr 1503341385], length 0
09:25:17.266362 IP 172.19.0.2.http > 172.19.0.3.40068: Flags [P.], seq 122279:162823, ack 86, win 509, options [nop,nop,TS val 1503341385 ecr 4033629266], length 40544: HTTP
09:25:17.266371 IP 172.19.0.3.40068 > 172.19.0.2.http: Flags [.], ack 162823, win 2133, options [nop,nop,TS val 4033629267 ecr 1503341385], length 0
09:25:17.266397 IP 172.19.0.2.http > 172.19.0.3.40068: Flags [P.], seq 162823:164111, ack 86, win 509, options [nop,nop,TS val 1503341386 ecr 4033629266], length 1288: HTTP
09:25:17.266433 IP 172.19.0.2.http > 172.19.0.3.40068: Flags [P.], seq 164111:195967, ack 86, win 509, options [nop,nop,TS val 1503341386 ecr 4033629267], length 31856: HTTP
09:25:17.266460 IP 172.19.0.2.http > 172.19.0.3.40068: Flags [P.], seq 195967:229271, ack 86, win 509, options [nop,nop,TS val 1503341386 ecr 4033629267], length 33304: HTTP
09:25:17.266479 IP 172.19.0.3.40068 > 172.19.0.2.http: Flags [.], ack 229271, win 3174, options [nop,nop,TS val 4033629267 ecr 1503341386], length 0
09:25:17.266491 IP 172.19.0.2.http > 172.19.0.3.40068: Flags [P.], seq 229271:261127, ack 86, win 509, options [nop,nop,TS val 1503341386 ecr 4033629267], length 31856: HTTP
09:25:17.266500 IP 172.19.0.3.40068 > 172.19.0.2.http: Flags [.], ack 261127, win 3672, options [nop,nop,TS val 4033629267 ecr 1503341386], length 0
09:25:17.266520 IP 172.19.0.2.http > 172.19.0.3.40068: Flags [P.], seq 261127:262415, ack 86, win 509, options [nop,nop,TS val 1503341386 ecr 4033629267], length 1288: HTTP
09:25:17.266547 IP 172.19.0.2.http > 172.19.0.3.40068: Flags [P.], seq 262415:294271, ack 86, win 509, options [nop,nop,TS val 1503341386 ecr 4033629267], length 31856: HTTP
09:25:17.266548 IP 172.19.0.3.40068 > 172.19.0.2.http: Flags [.], ack 262415, win 3694, options [nop,nop,TS val 4033629267 ecr 1503341386], length 0
09:25:17.266555 IP 172.19.0.3.40068 > 172.19.0.2.http: Flags [.], ack 294271, win 4192, options [nop,nop,TS val 4033629267 ecr 1503341386], length 0
09:25:17.266574 IP 172.19.0.2.http > 172.19.0.3.40068: Flags [P.], seq 294271:295183, ack 86, win 509, options [nop,nop,TS val 1503341386 ecr 4033629267], length 912: HTTP
09:25:17.266593 IP 172.19.0.3.40068 > 172.19.0.2.http: Flags [.], ack 295183, win 4215, options [nop,nop,TS val 4033629267 ecr 1503341386], length 0
09:25:17.266602 IP 172.19.0.2.http > 172.19.0.3.40068: Flags [P.], seq 295183:327039, ack 86, win 509, options [nop,nop,TS val 1503341386 ecr 4033629267], length 31856: HTTP
09:25:17.266610 IP 172.19.0.3.40068 > 172.19.0.2.http: Flags [.], ack 327039, win 4712, options [nop,nop,TS val 4033629267 ecr 1503341386], length 0
09:25:17.266629 IP 172.19.0.2.http > 172.19.0.3.40068: Flags [P.], seq 327039:327951, ack 86, win 509, options [nop,nop,TS val 1503341386 ecr 4033629267], length 912: HTTP
09:25:17.266637 IP 172.19.0.3.40068 > 172.19.0.2.http: Flags [.], ack 327951, win 4735, options [nop,nop,TS val 4033629267 ecr 1503341386], length 0
09:25:17.266672 IP 172.19.0.2.http > 172.19.0.3.40068: Flags [P.], seq 327951:360719, ack 86, win 509, options [nop,nop,TS val 1503341386 ecr 4033629267], length 32768: HTTP
09:25:17.266689 IP 172.19.0.3.40068 > 172.19.0.2.http: Flags [.], ack 360719, win 5247, options [nop,nop,TS val 4033629267 ecr 1503341386], length 0
09:25:17.266746 IP 172.19.0.2.http > 172.19.0.3.40068: Flags [P.], seq 360719:393487, ack 86, win 509, options [nop,nop,TS val 1503341386 ecr 4033629267], length 32768: HTTP
09:25:17.266764 IP 172.19.0.3.40068 > 172.19.0.2.http: Flags [.], ack 393487, win 5759, options [nop,nop,TS val 4033629267 ecr 1503341386], length 0
09:25:17.266824 IP 172.19.0.2.http > 172.19.0.3.40068: Flags [P.], seq 393487:426255, ack 86, win 509, options [nop,nop,TS val 1503341386 ecr 4033629267], length 32768: HTTP
09:25:17.266839 IP 172.19.0.3.40068 > 172.19.0.2.http: Flags [.], ack 426255, win 6271, options [nop,nop,TS val 4033629267 ecr 1503341386], length 0
09:25:17.266900 IP 172.19.0.2.http > 172.19.0.3.40068: Flags [P.], seq 426255:459023, ack 86, win 509, options [nop,nop,TS val 1503341386 ecr 4033629267], length 32768: HTTP
09:25:17.266918 IP 172.19.0.3.40068 > 172.19.0.2.http: Flags [.], ack 459023, win 6783, options [nop,nop,TS val 4033629267 ecr 1503341386], length 0
09:25:17.266988 IP 172.19.0.2.http > 172.19.0.3.40068: Flags [P.], seq 459023:491791, ack 86, win 509, options [nop,nop,TS val 1503341386 ecr 4033629267], length 32768: HTTP
09:25:17.267004 IP 172.19.0.3.40068 > 172.19.0.2.http: Flags [.], ack 491791, win 7295, options [nop,nop,TS val 4033629267 ecr 1503341386], length 0
09:25:17.267061 IP 172.19.0.2.http > 172.19.0.3.40068: Flags [P.], seq 491791:524559, ack 86, win 509, options [nop,nop,TS val 1503341386 ecr 4033629267], length 32768: HTTP
09:25:17.267076 IP 172.19.0.3.40068 > 172.19.0.2.http: Flags [.], ack 524559, win 7807, options [nop,nop,TS val 4033629267 ecr 1503341386], length 0
09:25:17.267134 IP 172.19.0.2.http > 172.19.0.3.40068: Flags [P.], seq 524559:557327, ack 86, win 509, options [nop,nop,TS val 1503341386 ecr 4033629267], length 32768: HTTP
09:25:17.267152 IP 172.19.0.3.40068 > 172.19.0.2.http: Flags [.], ack 557327, win 8319, options [nop,nop,TS val 4033629267 ecr 1503341386], length 0
09:25:17.267212 IP 172.19.0.2.http > 172.19.0.3.40068: Flags [P.], seq 557327:590095, ack 86, win 509, options [nop,nop,TS val 1503341386 ecr 4033629267], length 32768: HTTP
09:25:17.267231 IP 172.19.0.3.40068 > 172.19.0.2.http: Flags [.], ack 590095, win 8831, options [nop,nop,TS val 4033629267 ecr 1503341386], length 0
09:25:17.267289 IP 172.19.0.2.http > 172.19.0.3.40068: Flags [P.], seq 590095:622863, ack 86, win 509, options [nop,nop,TS val 1503341386 ecr 4033629267], length 32768: HTTP
09:25:17.267304 IP 172.19.0.3.40068 > 172.19.0.2.http: Flags [.], ack 622863, win 9343, options [nop,nop,TS val 4033629267 ecr 1503341386], length 0
09:25:17.267375 IP 172.19.0.2.http > 172.19.0.3.40068: Flags [P.], seq 622863:655631, ack 86, win 509, options [nop,nop,TS val 1503341386 ecr 4033629267], length 32768: HTTP
09:25:17.267392 IP 172.19.0.3.40068 > 172.19.0.2.http: Flags [.], ack 655631, win 9855, options [nop,nop,TS val 4033629268 ecr 1503341386], length 0
09:25:17.267448 IP 172.19.0.2.http > 172.19.0.3.40068: Flags [P.], seq 655631:688399, ack 86, win 509, options [nop,nop,TS val 1503341387 ecr 4033629268], length 32768: HTTP
09:25:17.267463 IP 172.19.0.3.40068 > 172.19.0.2.http: Flags [.], ack 688399, win 10367, options [nop,nop,TS val 4033629268 ecr 1503341387], length 0
09:25:17.267519 IP 172.19.0.2.http > 172.19.0.3.40068: Flags [P.], seq 688399:721167, ack 86, win 509, options [nop,nop,TS val 1503341387 ecr 4033629268], length 32768: HTTP
09:25:17.267534 IP 172.19.0.3.40068 > 172.19.0.2.http: Flags [.], ack 721167, win 10879, options [nop,nop,TS val 4033629268 ecr 1503341387], length 0
09:25:17.267586 IP 172.19.0.2.http > 172.19.0.3.40068: Flags [P.], seq 721167:753935, ack 86, win 509, options [nop,nop,TS val 1503341387 ecr 4033629268], length 32768: HTTP
09:25:17.267601 IP 172.19.0.3.40068 > 172.19.0.2.http: Flags [.], ack 753935, win 11391, options [nop,nop,TS val 4033629268 ecr 1503341387], length 0
09:25:17.267655 IP 172.19.0.2.http > 172.19.0.3.40068: Flags [P.], seq 753935:786703, ack 86, win 509, options [nop,nop,TS val 1503341387 ecr 4033629268], length 32768: HTTP
09:25:17.267670 IP 172.19.0.3.40068 > 172.19.0.2.http: Flags [.], ack 786703, win 11903, options [nop,nop,TS val 4033629268 ecr 1503341387], length 0
09:25:17.267698 IP 172.19.0.2.http > 172.19.0.3.40068: Flags [P.], seq 786703:819471, ack 86, win 509, options [nop,nop,TS val 1503341387 ecr 4033629268], length 32768: HTTP
09:25:17.267705 IP 172.19.0.3.40068 > 172.19.0.2.http: Flags [.], ack 819471, win 12415, options [nop,nop,TS val 4033629268 ecr 1503341387], length 0
09:25:17.267734 IP 172.19.0.2.http > 172.19.0.3.40068: Flags [P.], seq 819471:852239, ack 86, win 509, options [nop,nop,TS val 1503341387 ecr 4033629268], length 32768: HTTP
09:25:17.267741 IP 172.19.0.3.40068 > 172.19.0.2.http: Flags [.], ack 852239, win 12927, options [nop,nop,TS val 4033629268 ecr 1503341387], length 0
09:25:17.267768 IP 172.19.0.2.http > 172.19.0.3.40068: Flags [P.], seq 852239:885007, ack 86, win 509, options [nop,nop,TS val 1503341387 ecr 4033629268], length 32768: HTTP
09:25:17.267774 IP 172.19.0.3.40068 > 172.19.0.2.http: Flags [.], ack 885007, win 13439, options [nop,nop,TS val 4033629268 ecr 1503341387], length 0
09:25:17.267803 IP 172.19.0.2.http > 172.19.0.3.40068: Flags [P.], seq 885007:917775, ack 86, win 509, options [nop,nop,TS val 1503341387 ecr 4033629268], length 32768: HTTP
09:25:17.267810 IP 172.19.0.3.40068 > 172.19.0.2.http: Flags [.], ack 917775, win 13951, options [nop,nop,TS val 4033629268 ecr 1503341387], length 0
09:25:17.267840 IP 172.19.0.2.http > 172.19.0.3.40068: Flags [P.], seq 917775:950543, ack 86, win 509, options [nop,nop,TS val 1503341387 ecr 4033629268], length 32768: HTTP
09:25:17.267846 IP 172.19.0.3.40068 > 172.19.0.2.http: Flags [.], ack 950543, win 14463, options [nop,nop,TS val 4033629268 ecr 1503341387], length 0
09:25:17.267874 IP 172.19.0.2.http > 172.19.0.3.40068: Flags [P.], seq 950543:983311, ack 86, win 509, options [nop,nop,TS val 1503341387 ecr 4033629268], length 32768: HTTP
09:25:17.267882 IP 172.19.0.3.40068 > 172.19.0.2.http: Flags [.], ack 983311, win 14975, options [nop,nop,TS val 4033629268 ecr 1503341387], length 0
09:25:17.267912 IP 172.19.0.2.http > 172.19.0.3.40068: Flags [P.], seq 983311:1016079, ack 86, win 509, options [nop,nop,TS val 1503341387 ecr 4033629268], length 32768: HTTP
09:25:17.267918 IP 172.19.0.3.40068 > 172.19.0.2.http: Flags [.], ack 1016079, win 15382, options [nop,nop,TS val 4033629268 ecr 1503341387], length 0
09:25:17.267953 IP 172.19.0.2.http > 172.19.0.3.40068: Flags [P.], seq 1016079:1048847, ack 86, win 509, options [nop,nop,TS val 1503341387 ecr 4033629268], length 32768: HTTP
09:25:17.267961 IP 172.19.0.3.40068 > 172.19.0.2.http: Flags [.], ack 1048847, win 15382, options [nop,nop,TS val 4033629268 ecr 1503341387], length 0
09:25:17.267994 IP 172.19.0.2.http > 172.19.0.3.40068: Flags [P.], seq 1048847:1081615, ack 86, win 509, options [nop,nop,TS val 1503341387 ecr 4033629268], length 32768: HTTP
09:25:17.268001 IP 172.19.0.3.40068 > 172.19.0.2.http: Flags [.], ack 1081615, win 15382, options [nop,nop,TS val 4033629268 ecr 1503341387], length 0
09:25:17.268029 IP 172.19.0.2.http > 172.19.0.3.40068: Flags [P.], seq 1081615:1114383, ack 86, win 509, options [nop,nop,TS val 1503341387 ecr 4033629268], length 32768: HTTP
09:25:17.268035 IP 172.19.0.3.40068 > 172.19.0.2.http: Flags [.], ack 1114383, win 15382, options [nop,nop,TS val 4033629268 ecr 1503341387], length 0
09:25:17.268063 IP 172.19.0.2.http > 172.19.0.3.40068: Flags [P.], seq 1114383:1147151, ack 86, win 509, options [nop,nop,TS val 1503341387 ecr 4033629268], length 32768: HTTP
09:25:17.268070 IP 172.19.0.3.40068 > 172.19.0.2.http: Flags [.], ack 1147151, win 15382, options [nop,nop,TS val 4033629268 ecr 1503341387], length 0
09:25:17.268098 IP 172.19.0.2.http > 172.19.0.3.40068: Flags [P.], seq 1147151:1179919, ack 86, win 509, options [nop,nop,TS val 1503341387 ecr 4033629268], length 32768: HTTP
09:25:17.268105 IP 172.19.0.3.40068 > 172.19.0.2.http: Flags [.], ack 1179919, win 15382, options [nop,nop,TS val 4033629268 ecr 1503341387], length 0
09:25:17.268134 IP 172.19.0.2.http > 172.19.0.3.40068: Flags [P.], seq 1179919:1212687, ack 86, win 509, options [nop,nop,TS val 1503341387 ecr 4033629268], length 32768: HTTP
09:25:17.268140 IP 172.19.0.3.40068 > 172.19.0.2.http: Flags [.], ack 1212687, win 15382, options [nop,nop,TS val 4033629268 ecr 1503341387], length 0
09:25:17.268168 IP 172.19.0.2.http > 172.19.0.3.40068: Flags [P.], seq 1212687:1245455, ack 86, win 509, options [nop,nop,TS val 1503341387 ecr 4033629268], length 32768: HTTP
09:25:17.268175 IP 172.19.0.3.40068 > 172.19.0.2.http: Flags [.], ack 1245455, win 15382, options [nop,nop,TS val 4033629268 ecr 1503341387], length 0
09:25:17.268203 IP 172.19.0.2.http > 172.19.0.3.40068: Flags [P.], seq 1245455:1278223, ack 86, win 509, options [nop,nop,TS val 1503341387 ecr 4033629268], length 32768: HTTP
09:25:17.268210 IP 172.19.0.3.40068 > 172.19.0.2.http: Flags [.], ack 1278223, win 15382, options [nop,nop,TS val 4033629268 ecr 1503341387], length 0
09:25:17.268237 IP 172.19.0.2.http > 172.19.0.3.40068: Flags [P.], seq 1278223:1310991, ack 86, win 509, options [nop,nop,TS val 1503341387 ecr 4033629268], length 32768: HTTP
09:25:17.268244 IP 172.19.0.3.40068 > 172.19.0.2.http: Flags [.], ack 1310991, win 15382, options [nop,nop,TS val 4033629268 ecr 1503341387], length 0
09:25:17.268271 IP 172.19.0.2.http > 172.19.0.3.40068: Flags [P.], seq 1310991:1343759, ack 86, win 509, options [nop,nop,TS val 1503341387 ecr 4033629268], length 32768: HTTP
09:25:17.268277 IP 172.19.0.3.40068 > 172.19.0.2.http: Flags [.], ack 1343759, win 15382, options [nop,nop,TS val 4033629268 ecr 1503341387], length 0
09:25:17.268305 IP 172.19.0.2.http > 172.19.0.3.40068: Flags [P.], seq 1343759:1376527, ack 86, win 509, options [nop,nop,TS val 1503341387 ecr 4033629268], length 32768: HTTP
09:25:17.268312 IP 172.19.0.3.40068 > 172.19.0.2.http: Flags [.], ack 1376527, win 15382, options [nop,nop,TS val 4033629268 ecr 1503341387], length 0
09:25:17.268339 IP 172.19.0.2.http > 172.19.0.3.40068: Flags [P.], seq 1376527:1409295, ack 86, win 509, options [nop,nop,TS val 1503341387 ecr 4033629268], length 32768: HTTP
09:25:17.268345 IP 172.19.0.3.40068 > 172.19.0.2.http: Flags [.], ack 1409295, win 15382, options [nop,nop,TS val 4033629268 ecr 1503341387], length 0
09:25:17.268384 IP 172.19.0.2.http > 172.19.0.3.40068: Flags [P.], seq 1409295:1428756, ack 86, win 509, options [nop,nop,TS val 1503341388 ecr 4033629268], length 19461: HTTP
09:25:17.268391 IP 172.19.0.3.40068 > 172.19.0.2.http: Flags [.], ack 1428756, win 15474, options [nop,nop,TS val 4033629269 ecr 1503341388], length 0
09:25:17.268550 IP 172.19.0.3.40068 > 172.19.0.2.http: Flags [F.], seq 86, ack 1428756, win 15474, options [nop,nop,TS val 4033629269 ecr 1503341388], length 0
09:25:17.268596 IP 172.19.0.2.http > 172.19.0.3.40068: Flags [F.], seq 1428756, ack 87, win 509, options [nop,nop,TS val 1503341388 ecr 4033629269], length 0
09:25:17.268613 IP 172.19.0.3.40068 > 172.19.0.2.http: Flags [.], ack 1428757, win 15474, options [nop,nop,TS val 4033629269 ecr 1503341388], length 0
09:25:22.275611 IP 172.19.0.3.40080 > 172.19.0.2.http: Flags [S], seq 3252027744, win 64240, options [mss 1460,sackOK,TS val 4033634276 ecr 0,nop,wscale 7], length 0
09:25:22.275655 IP 172.19.0.2.http > 172.19.0.3.40080: Flags [S.], seq 4294505991, ack 3252027745, win 65160, options [mss 1460,sackOK,TS val 1503346395 ecr 4033634276,nop,wscale 7], length 0
09:25:22.275672 IP 172.19.0.3.40080 > 172.19.0.2.http: Flags [.], ack 1, win 502, options [nop,nop,TS val 4033634276 ecr 1503346395], length 0
09:25:22.275734 IP 172.19.0.3.40080 > 172.19.0.2.http: Flags [P.], seq 1:86, ack 1, win 502, options [nop,nop,TS val 4033634276 ecr 1503346395], length 85: HTTP: GET /video.mp4 HTTP/1.1
09:25:22.275749 IP 172.19.0.2.http > 172.19.0.3.40080: Flags [.], ack 86, win 509, options [nop,nop,TS val 1503346395 ecr 4033634276], length 0
09:25:22.275988 IP 172.19.0.2.http > 172.19.0.3.40080: Flags [P.], seq 1:7241, ack 86, win 509, options [nop,nop,TS val 1503346395 ecr 4033634276], length 7240: HTTP: HTTP/1.1 200 OK
09:25:22.276013 IP 172.19.0.3.40080 > 172.19.0.2.http: Flags [.], ack 7241, win 614, options [nop,nop,TS val 4033634276 ecr 1503346395], length 0
09:25:22.276052 IP 172.19.0.2.http > 172.19.0.3.40080: Flags [P.], seq 7241:14481, ack 86, win 509, options [nop,nop,TS val 1503346395 ecr 4033634276], length 7240: HTTP
09:25:22.276064 IP 172.19.0.3.40080 > 172.19.0.2.http: Flags [.], ack 14481, win 727, options [nop,nop,TS val 4033634276 ecr 1503346395], length 0
09:25:22.276103 IP 172.19.0.2.http > 172.19.0.3.40080: Flags [P.], seq 14481:28961, ack 86, win 509, options [nop,nop,TS val 1503346395 ecr 4033634276], length 14480: HTTP
09:25:22.276118 IP 172.19.0.3.40080 > 172.19.0.2.http: Flags [.], ack 28961, win 802, options [nop,nop,TS val 4033634276 ecr 1503346395], length 0
09:25:22.276145 IP 172.19.0.2.http > 172.19.0.3.40080: Flags [P.], seq 28961:33039, ack 86, win 509, options [nop,nop,TS val 1503346395 ecr 4033634276], length 4078: HTTP
09:25:22.276161 IP 172.19.0.3.40080 > 172.19.0.2.http: Flags [.], ack 33039, win 866, options [nop,nop,TS val 4033634276 ecr 1503346395], length 0
09:25:22.276220 IP 172.19.0.2.http > 172.19.0.3.40080: Flags [P.], seq 33039:56207, ack 86, win 509, options [nop,nop,TS val 1503346395 ecr 4033634276], length 23168: HTTP
09:25:22.276235 IP 172.19.0.3.40080 > 172.19.0.2.http: Flags [.], ack 56207, win 742, options [nop,nop,TS val 4033634276 ecr 1503346395], length 0
09:25:22.276262 IP 172.19.0.2.http > 172.19.0.3.40080: Flags [P.], seq 56207:65807, ack 86, win 509, options [nop,nop,TS val 1503346395 ecr 4033634276], length 9600: HTTP
09:25:22.276275 IP 172.19.0.3.40080 > 172.19.0.2.http: Flags [.], ack 65807, win 836, options [nop,nop,TS val 4033634276 ecr 1503346395], length 0
09:25:22.276328 IP 172.19.0.2.http > 172.19.0.3.40080: Flags [P.], seq 65807:98575, ack 86, win 509, options [nop,nop,TS val 1503346395 ecr 4033634276], length 32768: HTTP
09:25:22.276343 IP 172.19.0.3.40080 > 172.19.0.2.http: Flags [.], ack 98575, win 675, options [nop,nop,TS val 4033634276 ecr 1503346395], length 0
09:25:22.276429 IP 172.19.0.2.http > 172.19.0.3.40080: Flags [P.], seq 98575:131343, ack 86, win 509, options [nop,nop,TS val 1503346396 ecr 4033634276], length 32768: HTTP
09:25:22.276444 IP 172.19.0.3.40080 > 172.19.0.2.http: Flags [.], ack 131343, win 1378, options [nop,nop,TS val 4033634277 ecr 1503346396], length 0
09:25:22.276492 IP 172.19.0.2.http > 172.19.0.3.40080: Flags [P.], seq 131343:164111, ack 86, win 509, options [nop,nop,TS val 1503346396 ecr 4033634277], length 32768: HTTP
09:25:22.276513 IP 172.19.0.3.40080 > 172.19.0.2.http: Flags [.], ack 164111, win 1890, options [nop,nop,TS val 4033634277 ecr 1503346396], length 0
09:25:22.276614 IP 172.19.0.2.http > 172.19.0.3.40080: Flags [P.], seq 164111:196879, ack 86, win 509, options [nop,nop,TS val 1503346396 ecr 4033634277], length 32768: HTTP
09:25:22.276629 IP 172.19.0.3.40080 > 172.19.0.2.http: Flags [.], ack 196879, win 2402, options [nop,nop,TS val 4033634277 ecr 1503346396], length 0
09:25:22.276677 IP 172.19.0.2.http > 172.19.0.3.40080: Flags [P.], seq 196879:229647, ack 86, win 509, options [nop,nop,TS val 1503346396 ecr 4033634277], length 32768: HTTP
09:25:22.276690 IP 172.19.0.3.40080 > 172.19.0.2.http: Flags [.], ack 229647, win 2914, options [nop,nop,TS val 4033634277 ecr 1503346396], length 0
09:25:22.276741 IP 172.19.0.2.http > 172.19.0.3.40080: Flags [P.], seq 229647:262415, ack 86, win 509, options [nop,nop,TS val 1503346396 ecr 4033634277], length 32768: HTTP
09:25:22.276755 IP 172.19.0.3.40080 > 172.19.0.2.http: Flags [.], ack 262415, win 3426, options [nop,nop,TS val 4033634277 ecr 1503346396], length 0
09:25:22.276803 IP 172.19.0.2.http > 172.19.0.3.40080: Flags [P.], seq 262415:295183, ack 86, win 509, options [nop,nop,TS val 1503346396 ecr 4033634277], length 32768: HTTP
